<?xml version="1.0" encoding="UTF-8"?>
<!DOCTYPE mappings SYSTEM "mappings.dtd" >

<!-- examples of mapping for applying xsl transformation to xml sources 
See projet documentation for complete syntax reference
xlstFiles given here are only samples and must be copied and modified on your own domain
-->
<mappings>
<!-- 
	<mapping 
		sourceURL="http://info.cri.univ-rennes1.fr/rss/rss.php"
		xsltFile="http://partages.univ-rennes1.fr/files/partages/Services/CRI/SI/conf_lecture_gwe_ray/stylesheet01.xsl"
		itemXPath="/rdf:RDF/default:item">
		<XPathNameSpace prefix="rdf" uri="http://www.w3.org/1999/02/22-rdf-syntax-ns#"/>
		<XPathNameSpace prefix="default" uri="http://purl.org/rss/1.0/" />
	</mapping>
 -->
	<mapping 
		sourceURL="${config.url.prefix}/examples/xml/flux.offline1.xml"
		xsltFile="${config.url.prefix}/examples/xsl/rss-jquery-clickable.xsl"
		mobileXsltFile="${config.url.prefix}/examples/xsl/rss-mobile.xsl"
		itemXPath="/rss/channel/item">
	</mapping>
	<mapping 
		sourceURL="${config.url.prefix}/examples/xml/flux.offline2.xml"
		xsltFile="${config.url.prefix}/examples/xsl/rss-jquery-inline.xsl"
		mobileXsltFile="${config.url.prefix}/examples/xsl/rss-mobile.xsl"
		itemXPath="/rss/channel/item">
	</mapping>
	<mapping 
		sourceURL="${config.url.prefix}/examples/xml/flux.offline3.xml"
		xsltFile="${config.url.prefix}/examples/xsl/rss-jquery-dialog.xsl"
		mobileXsltFile="${config.url.prefix}/examples/xsl/rss-mobile.xsl"
		itemXPath="/rss/channel/item">
	</mapping>
	<mapping 
		rootElement="rss"
		xsltFile="${config.url.prefix}/examples/xsl/rss-jquery-inline.xsl"
		mobileXsltFile="${config.url.prefix}/examples/xsl/rss-mobile.xsl"
		itemXPath="/rss/channel/item">
	</mapping>
<!-- Same format as above, but with thickbox style : comment one of them -->
<!--
	<mapping 
		rootElement="rss"
		xsltFile="http://partages.univ-rennes1.fr/files/partages/Services/CRI/SI/conf_lecture_gwe_ray/rss-thickbox.xsl"
		itemXPath="/rss/channel/item">
	</mapping>
-->

	<mapping 
		rootElement="RDF"
		xsltFile="${config.url.prefix}/examples/xsl/rdf.xsl"
		itemXPath="/rdf:RDF/default:item">
		<XPathNameSpace prefix="rdf" uri="http://www.w3.org/1999/02/22-rdf-syntax-ns#"/>
		<XPathNameSpace prefix="default" uri="http://purl.org/rss/1.0/" />
	</mapping>

	<mapping 
		rootElement="flash"
		xsltFile="${config.url.prefix}/examples/xsl/flash.xsl"
		itemXPath="/flash/object">
	</mapping>

	<mapping 
		rootElement="java"
		xsltFile="${config.url.prefix}/examples/xsl/java.xsl"
		itemXPath="/java/applet">
	</mapping>
</mappings>