<?xml version="1.0" encoding="UTF-8"?>
<!DOCTYPE mappings SYSTEM "mappings.dtd" [
<!ENTITY repConf "file:///d:/tmp/conf_lecture_gwe_ray/" >
] >
<mappings>
	<mapping 
		sourceURL="http://info.cri.univ-rennes1.fr/rss/rss.php"
		xsltFile="&repConf;stylesheet01.xsl"
		itemXPath="/rdf:RDF/default:item">
		<XPathNameSpace prefix="rdf" uri="http://www.w3.org/1999/02/22-rdf-syntax-ns#"/>
		<XPathNameSpace prefix="default" uri="http://purl.org/rss/1.0/" />
	</mapping>
	<mapping 
		rootElement="rss"
		xsltFile="&repConf;stylesheet02.xsl"
		itemXPath="/rss/channel/item">
	</mapping>
	<mapping 
		rootElement="flash"
		xsltFile="&repConf;flash.xsl"
		itemXPath="/flash/object">
	</mapping>
	<mapping 
		rootElement="java"
		xsltFile="&repConf;java.xsl"
		itemXPath="/java/applet">
	</mapping>
	<mapping 
		rootElement="iframes"
		xsltFile="&repConf;java.xsl"
		itemXPath="/iframes/iframe">
	</mapping>
</mappings>