<?xml version="1.0" encoding="UTF-8"?>
<!DOCTYPE mappings SYSTEM "mappings.dtd" [
<!ENTITY repConf "file:///data/webapps/ent.univ-rennes1.fr/application/esup-lecture/properties" >
<!ENTITY httpConf "http://ent.univ-rennes1.fr/"
] 
>
<!-- examples of mapping for applying xsl transformation to xml sources 
See projet documentation for complete syntax reference
xlstFiles given here are only samples and must be copied and modified on your own domain
-->
<mappings>
	<mapping 
		sourceURL="http://ent.univ-rennes1.fr/newsPortlet/"
		xsltFile="&repConf;rss-newsPortlet.example.xsl"
		itemXPath="/rss/channel/item">
	</mapping>
	<mapping 
		sourceURL="http://demo.ori-oai.org/search/advanced-search.htm"
		xsltFile="&repConf;rss-newsPortlet.example.xsl"
		itemXPath="/rss/channel/item">
	</mapping>
	<mapping 
		sourceURL="http://www.univ-rennes1.fr/bas-de-page/RSS/actualites/"
		xsltFile="&repConf;actu-infoglue.example.xsl"
		itemXPath="/rdf:RDF/default:item">
		<XPathNameSpace prefix="rdf" uri="http://www.w3.org/1999/02/22-rdf-syntax-ns#"/>
		<XPathNameSpace prefix="default" uri="http://purl.org/rss/1.0/" />
	</mapping>
	<mapping 
		rootElement="rdf:RDF"
		xsltFile="&repConf;rss.example.xsl"
		itemXPath="/rdf:RDF/default:item">
		<XPathNameSpace prefix="rdf" uri="http://www.w3.org/1999/02/22-rdf-syntax-ns#"/>
		<XPathNameSpace prefix="default" uri="http://purl.org/rss/1.0/" />
	</mapping>
	<mapping 
		rootElement="RDF"
		xsltFile="&repConf;rss.example.xsl"
		itemXPath="/rdf:RDF/default:item">
		<XPathNameSpace prefix="rdf" uri="http://www.w3.org/1999/02/22-rdf-syntax-ns#"/>
		<XPathNameSpace prefix="default" uri="http://purl.org/rss/1.0/" />
	</mapping>
	<mapping 
		rootElement="rdf"
		xsltFile="&repConf;rss.example.xsl"
		itemXPath="/rdf:RDF/default:item">
		<XPathNameSpace prefix="rdf" uri="http://www.w3.org/1999/02/22-rdf-syntax-ns#"/>
		<XPathNameSpace prefix="default" uri="http://purl.org/rss/1.0/" />
	</mapping>
	<mapping 
		rootElement="rss"
		xsltFile="&repConf;rss-simple.example.xsl"
		itemXPath="/rss/channel/item">
	</mapping>
	<mapping 
		rootElement="flash"
		xsltFile="&repConf;flash.example.xsl"
		itemXPath="/flash/object">
	</mapping>
	<mapping 
		rootElement="java"
		xsltFile="&repConf;java.example.xsl"
		itemXPath="/java/applet">
	</mapping>
	<mapping 
		rootElement="iframes"
		xsltFile="&repConf;java.example.xsl"
		itemXPath="/iframes/iframe">
	</mapping>

</mappings>